{
  "gameId": "frlg",
  "title": "FireRed / LeafGreen",
  "group": "gen3",
  "generation": 3,
  "versions": [
    "firered",
    "leafgreen"
  ],
  "sections": [
    {
      "id": "kanto",
      "title": "Kanto Pokédex",
      "type": "base",
      "optional": false,
      "defaultEnabled": false,
      "startIndex": 1,
      "entries": [
        {
          "speciesId": 1,
          "formId": 1,
          "dexNumber": 1
        },
        {
          "speciesId": 2,
          "formId": 2,
          "dexNumber": 2
        },
        {
          "speciesId": 3,
          "formId": 3,
          "dexNumber": 3
        },
        {
          "speciesId": 4,
          "formId": 4,
          "dexNumber": 4
        },
        {
          "speciesId": 5,
          "formId": 5,
          "dexNumber": 5
        },
        {
          "speciesId": 6,
          "formId": 6,
          "dexNumber": 6
        },
        {
          "speciesId": 7,
          "formId": 7,
          "dexNumber": 7
        },
        {
          "speciesId": 8,
          "formId": 8,
          "dexNumber": 8
        },
        {
          "speciesId": 9,
          "formId": 9,
          "dexNumber": 9
        },
        {
          "speciesId": 10,
          "formId": 10,
          "dexNumber": 10
        },
        {
          "speciesId": 11,
          "formId": 11,
          "dexNumber": 11
        },
        {
          "speciesId": 12,
          "formId": 12,
          "dexNumber": 12
        },
        {
          "speciesId": 13,
          "formId": 13,
          "dexNumber": 13
        },
        {
          "speciesId": 14,
          "formId": 14,
          "dexNumber": 14
        },
        {
          "speciesId": 15,
          "formId": 15,
          "dexNumber": 15
        },
        {
          "speciesId": 16,
          "formId": 16,
          "dexNumber": 16
        },
        {
          "speciesId": 17,
          "formId": 17,
          "dexNumber": 17
        },
        {
          "speciesId": 18,
          "formId": 18,
          "dexNumber": 18
        },
        {
          "speciesId": 19,
          "formId": 19,
          "dexNumber": 19
        },
        {
          "speciesId": 20,
          "formId": 20,
          "dexNumber": 20
        },
        {
          "speciesId": 21,
          "formId": 21,
          "dexNumber": 21
        },
        {
          "speciesId": 22,
          "formId": 22,
          "dexNumber": 22
        },
        {
          "speciesId": 23,
          "formId": 23,
          "dexNumber": 23
        },
        {
          "speciesId": 24,
          "formId": 24,
          "dexNumber": 24
        },
        {
          "speciesId": 25,
          "formId": 25,
          "dexNumber": 25
        },
        {
          "speciesId": 26,
          "formId": 26,
          "dexNumber": 26
        },
        {
          "speciesId": 27,
          "formId": 27,
          "dexNumber": 27
        },
        {
          "speciesId": 28,
          "formId": 28,
          "dexNumber": 28
        },
        {
          "speciesId": 29,
          "formId": 29,
          "dexNumber": 29
        },
        {
          "speciesId": 30,
          "formId": 30,
          "dexNumber": 30
        },
        {
          "speciesId": 31,
          "formId": 31,
          "dexNumber": 31
        },
        {
          "speciesId": 32,
          "formId": 32,
          "dexNumber": 32
        },
        {
          "speciesId": 33,
          "formId": 33,
          "dexNumber": 33
        },
        {
          "speciesId": 34,
          "formId": 34,
          "dexNumber": 34
        },
        {
          "speciesId": 35,
          "formId": 35,
          "dexNumber": 35
        },
        {
          "speciesId": 36,
          "formId": 36,
          "dexNumber": 36
        },
        {
          "speciesId": 37,
          "formId": 37,
          "dexNumber": 37
        },
        {
          "speciesId": 38,
          "formId": 38,
          "dexNumber": 38
        },
        {
          "speciesId": 39,
          "formId": 39,
          "dexNumber": 39
        },
        {
          "speciesId": 40,
          "formId": 40,
          "dexNumber": 40
        },
        {
          "speciesId": 41,
          "formId": 41,
          "dexNumber": 41
        },
        {
          "speciesId": 42,
          "formId": 42,
          "dexNumber": 42
        },
        {
          "speciesId": 43,
          "formId": 43,
          "dexNumber": 43
        },
        {
          "speciesId": 44,
          "formId": 44,
          "dexNumber": 44
        },
        {
          "speciesId": 45,
          "formId": 45,
          "dexNumber": 45
        },
        {
          "speciesId": 46,
          "formId": 46,
          "dexNumber": 46
        },
        {
          "speciesId": 47,
          "formId": 47,
          "dexNumber": 47
        },
        {
          "speciesId": 48,
          "formId": 48,
          "dexNumber": 48
        },
        {
          "speciesId": 49,
          "formId": 49,
          "dexNumber": 49
        },
        {
          "speciesId": 50,
          "formId": 50,
          "dexNumber": 50
        },
        {
          "speciesId": 51,
          "formId": 51,
          "dexNumber": 51
        },
        {
          "speciesId": 52,
          "formId": 52,
          "dexNumber": 52
        },
        {
          "speciesId": 53,
          "formId": 53,
          "dexNumber": 53
        },
        {
          "speciesId": 54,
          "formId": 54,
          "dexNumber": 54
        },
        {
          "speciesId": 55,
          "formId": 55,
          "dexNumber": 55
        },
        {
          "speciesId": 56,
          "formId": 56,
          "dexNumber": 56
        },
        {
          "speciesId": 57,
          "formId": 57,
          "dexNumber": 57
        },
        {
          "speciesId": 58,
          "formId": 58,
          "dexNumber": 58
        },
        {
          "speciesId": 59,
          "formId": 59,
          "dexNumber": 59
        },
        {
          "speciesId": 60,
          "formId": 60,
          "dexNumber": 60
        },
        {
          "speciesId": 61,
          "formId": 61,
          "dexNumber": 61
        },
        {
          "speciesId": 62,
          "formId": 62,
          "dexNumber": 62
        },
        {
          "speciesId": 63,
          "formId": 63,
          "dexNumber": 63
        },
        {
          "speciesId": 64,
          "formId": 64,
          "dexNumber": 64
        },
        {
          "speciesId": 65,
          "formId": 65,
          "dexNumber": 65
        },
        {
          "speciesId": 66,
          "formId": 66,
          "dexNumber": 66
        },
        {
          "speciesId": 67,
          "formId": 67,
          "dexNumber": 67
        },
        {
          "speciesId": 68,
          "formId": 68,
          "dexNumber": 68
        },
        {
          "speciesId": 69,
          "formId": 69,
          "dexNumber": 69
        },
        {
          "speciesId": 70,
          "formId": 70,
          "dexNumber": 70
        },
        {
          "speciesId": 71,
          "formId": 71,
          "dexNumber": 71
        },
        {
          "speciesId": 72,
          "formId": 72,
          "dexNumber": 72
        },
        {
          "speciesId": 73,
          "formId": 73,
          "dexNumber": 73
        },
        {
          "speciesId": 74,
          "formId": 74,
          "dexNumber": 74
        },
        {
          "speciesId": 75,
          "formId": 75,
          "dexNumber": 75
        },
        {
          "speciesId": 76,
          "formId": 76,
          "dexNumber": 76
        },
        {
          "speciesId": 77,
          "formId": 77,
          "dexNumber": 77
        },
        {
          "speciesId": 78,
          "formId": 78,
          "dexNumber": 78
        },
        {
          "speciesId": 79,
          "formId": 79,
          "dexNumber": 79
        },
        {
          "speciesId": 80,
          "formId": 80,
          "dexNumber": 80
        },
        {
          "speciesId": 81,
          "formId": 81,
          "dexNumber": 81
        },
        {
          "speciesId": 82,
          "formId": 82,
          "dexNumber": 82
        },
        {
          "speciesId": 83,
          "formId": 83,
          "dexNumber": 83
        },
        {
          "speciesId": 84,
          "formId": 84,
          "dexNumber": 84
        },
        {
          "speciesId": 85,
          "formId": 85,
          "dexNumber": 85
        },
        {
          "speciesId": 86,
          "formId": 86,
          "dexNumber": 86
        },
        {
          "speciesId": 87,
          "formId": 87,
          "dexNumber": 87
        },
        {
          "speciesId": 88,
          "formId": 88,
          "dexNumber": 88
        },
        {
          "speciesId": 89,
          "formId": 89,
          "dexNumber": 89
        },
        {
          "speciesId": 90,
          "formId": 90,
          "dexNumber": 90
        },
        {
          "speciesId": 91,
          "formId": 91,
          "dexNumber": 91
        },
        {
          "speciesId": 92,
          "formId": 92,
          "dexNumber": 92
        },
        {
          "speciesId": 93,
          "formId": 93,
          "dexNumber": 93
        },
        {
          "speciesId": 94,
          "formId": 94,
          "dexNumber": 94
        },
        {
          "speciesId": 95,
          "formId": 95,
          "dexNumber": 95
        },
        {
          "speciesId": 96,
          "formId": 96,
          "dexNumber": 96
        },
        {
          "speciesId": 97,
          "formId": 97,
          "dexNumber": 97
        },
        {
          "speciesId": 98,
          "formId": 98,
          "dexNumber": 98
        },
        {
          "speciesId": 99,
          "formId": 99,